{
    "status": "partial_success",
    "message": "Partial URLs scraped and CSV generated.",
    "data": {
        "attachment": {
            "filename": "partial_products_data.csv",
            "content_type": "text/csv",
            "data": "Base64 encoded CSV data for successful URLs..."
        }
    },
    "not_scrapped": ["http://failed-url1.com", "http://failed-url2.com"]
}
